,id,pmid,source,doi,authors,journal,title,abstract,year,language
3,4,23369444.0,embase,10.1016/j.arthro.2012.10.023,"Noh J.H., Yang B.G., Yi S.R., Roh Y.H., Lee J.S.",Arthroscopy - Journal of Arthroscopic and Related Surgery,Single-bundle anterior cruciate ligament reconstruction in active young men using bone-tendon achilles allograft versus free tendon achilles allograft,"Purpose: The purpose was to prospectively compare the outcomes of anterior cruciate ligament (ACL) reconstruction using bone-tendon Achilles allograft with those of free tendon Achilles allograft in 2 groups of active young men. Methods: We enrolled 72 subjects in the study. Of these, 33 subjects who had ACL reconstruction with Achilles allograft with calcaneal bone block on its end (group I) and 34 who had ACL reconstruction with free tendon Achilles allograft (group II) were followed up for a minimum of 2 years. The Lachman test, pivot-shift test, and 1-leg hop test were evaluated at the last follow-up. The International Knee Documentation Committee classification, Lysholm score, and side-to-side difference were assessed preoperatively and at the last follow-up. The Tegner activity scale was evaluated before injury and at the last follow-up. Results: The mean follow-up period was 30.9 months (range, 26 to 38 months). At the last follow-up, there were no statistically significant differences between the 2 groups for the Lachman test, pivot-shift test, 1-leg hop test, International Knee Documentation Committee classification, Lysholm score, and side-to-side difference (P >.05). Three subjects in group I and three in group II showed an activity level 2 steps below the preinjury activity level. The rest of the subjects returned to the preinjury activity level or showed a level 1 step below the preinjury activity level. Conclusions: There were no significant differences in clinical outcomes of ACL reconstructions using Achilles allograft between the bone-tendon group and the free tendon group in active young men. Free tendon Achilles allograft may be considered an option for ACL reconstruction. Level of Evidence: Level II, therapeutic study, randomized controlled trial. © 2013 by the Arthroscopy Association of North America.",2013,English
4,5,22732367.0,embase,10.1016/j.arthro.2012.03.012,"Noh J.H., Yang B.G., Yi S.R., Roh Y.H., Lee J.S.",Arthroscopy - Journal of Arthroscopic and Related Surgery,Hybrid tibial fixation for anterior cruciate ligament reconstruction with achilles tendon allograft,"Purpose: To compare clinical outcomes of tibial fixation between a biodegradable interference screw only and a biodegradable interference screw supplemented by a post-tie using a washer screw in single-bundle anterior cruciate ligament (ACL) reconstruction with 2-strand free tendon Achilles allograft in active young men. Methods: A prospective study was performed in 80 subjects who underwent single-bundle ACL reconstruction. A 2-strand free tendon Achilles allograft fixed with an EndoButton (Smith & Nephew, Andover, MA) in the femoral tunnel and with a Bio-Interference screw (Arthrex, Naples, FL) in the tibial tunnel was used in group I. Supplementary fixation was performed with a post-tie using a washer screw in group II. The Lachman test, pivot-shift test, International Knee Documentation Committee classification, Lysholm score, range of knee motion, and side-to-side difference were evaluated preoperatively and at the last follow-up. The Tegner activity scale was evaluated before injury and at the last follow-up. The 1-leg hop test was assessed at the last follow-up. Results: Of the patients, 36 in group I and 35 in group II could be followed up for at least 2 years. At the last follow-up, 7 patients in group I and 1 in group II showed a 2+ or 3+ on the Lachman test (P =.027). The mean side-to-side difference was 2.9 ± 2.3 mm in group I and 1.4 ± 1.6 mm in group II at the last follow-up (P =.002). The other clinical outcomes were not significantly different between the 2 groups. Conclusions: Supplementary tibial fixation with a post-tie in ACL reconstruction using 2-strand free tendon Achilles allograft was more effective than a biodegradable interference screw only in restoration of the anterior stability of the tibia. Level of Evidence: Level II, randomized controlled trial. © 2012 Arthroscopy Association of North America.",2012,English
0,1,41703942.0,web_of_science,10.1177/19417381251412905,"BusÃ , MF; Zago, M; Buckthorpe, M; Esposito, F; Della Villa, F",SPORTS HEALTH-A MULTIDISCIPLINARY APPROACH,Which Criteria Are Used to Clear Athletes to Return to Sport After Achilles Tendon Repair? A Scoping Review,"Context: Achilles tendon (AT) rupture is a devastating and potentially career-ending injury. Compared with other severe lower extremity injuries, such as anterior cruciate ligament reconstruction, it is associated with lower return to sport (RTS) rates, longer absence from training and competition, reduced sport-specific performance in the 2 years after rupture, shorter career length, and persistent long-term functional deficits. Therefore, better knowledge of the RTS criteria after AT rupture may support the optimization of rehabilitation outcomes and improve long-term RTS success.Objective: The purposes of this scoping review were to (1) map the scientific evidence regarding criteria used to clear patients to RTS after surgical AT repair, and (2) describe the predominant outcome measurements reported in the literature.Data Sources: Web of Science, Scopus, and MEDLINE databases.Study Selection: A scoping review was conducted following the Preferred Reporting Items for Systematic Reviews and Meta-Analyses extension for Scoping Reviews framework, including English-language studies published from 1995 to 2022 on ""athletes"" or ""sportive patients"" who underwent surgical AT repair.Study Design: Scoping review.Level of Evidence: Level 3.Results: Of 589 studies identified, 34 met the inclusion criteria: 3% were randomized controlled trials, 50% were case series, and 47% were cohort studies. None defined an outcome measurement as a criterion to RTS. The main outcomes were timeframe from surgery to RTS (53%), ankle range of motion (47%), Achilles Tendon Rupture Score (47%), calf circumference (44%), and heel-rise test (44%).Conclusion: None of the 34 studies defined an outcome measurements as criteria for RTS. The main measurements focused on the early rehabilitation stage, with limited standardization and a lack of assessment for the mid- and late stages of rehabilitation. Defining RTS criteria after AT repair may help optimize rehabilitation and the RTS process.",2026,English
1,2,28953136.0,web_of_science,10.2106/JBJS.RVW.17.00024,"Wang, D; Rodeo, SA",JBJS REVIEWS,PLATELET-RICH PLASMA IN ORTHOPAEDIC SURGERY A Critical Analysis Review,"Platelet-rich plasma has shown great promise and potential to stimulate biologic activity in difficult-to-heal musculoskeletal tissue. However, the optimal formulation, method of administration, and dosing for different tissues have yet to be determined. Within a given platelet-rich plasma preparation technique, there is a high degree of inter-subject and intra-subject variability in the composition of platelet-rich plasma produced. This likely contributes to the inconsistent results reported in the current platelet-rich plasma literature. Current evidence best supports the use of platelet-rich plasma as a treatment for osteoarthritis of the knee. Evidence on the use of platelet-rich plasma as a treatment or adjunct for rotator cuff repair, lateral epicondylitis, hamstring injuries, anterior cruciate ligament (ACL) reconstruction, patellar tendinopathy, Achilles tendinopathy, and fractures is inconsistent or only available from low-powered studies. To our knowledge, no comparative studies examining platelet-rich plasma treatment for partial ulnar collateral ligament tears in the elbow currently exist. Current evidence suggests that different platelet-rich plasma formulations are needed for different tissues and pathologies. Ultimately, improved understanding of the underlying structural and compositional deficiencies of the injured tissue will help to identify the biologic needs that can potentially be targeted with platelet-rich plasma.",2017,English
2,3,27682300.0,web_of_science,,"Noh, JH; Kyung, HS; Yoon, KH; Roh, YH",ACTA ORTHOPAEDICA BELGICA,Supplementary tibial fixation in anterior cruciate ligament reconstruction - Direct cortical fixation using spiked washer screw vs. post-tie using washer screw,"We compare clinical outcomes of two different supplementary tibial fixation in anterior cruciate ligament (ACL) reconstruction using free tendon Achilles allograft. Eighty subjects underwent ACL reconstruction using Endobutton CL for femoral fixation and Bio-interference screw for tibial fixation. Supplementary tibial fixation was performed as direct cortical fixation using spiked washer screw (group I) or as post-tie using washer screw (group II). Lachman test, pivot shift test, IKDC classification, Lysholm score, and side-to-side difference (SSD) were evaluated. Thirty six in group I and thirty five in group II could follow up for at least 2 years. At the last followup, 7 in group I and 1 in group II showed 2+ or 3+ in Lachman test (p = 0.027). Mean SSD was 2.4mm in group I and 1 Amm in group II (p = 0.048). Post-tie using washer screw was more effective than direct cortical fixation using spiked washer screw to restore stability. Level of evidence : Therapeutic Level I; Randomized controlled clinical trial.",2016,English
3,4,25108904.0,web_of_science,10.1016/j.arthro.2014.05.040,"Cvetanovich, GL; Mascarenhas, R; Saccomanno, MF; Verma, NN; Cole, BJ; Bush-Joseph, CA; Bach, BR",ARTHROSCOPY-THE JOURNAL OF ARTHROSCOPIC AND RELATED SURGERY,Hamstring Autograft Versus Soft-Tissue Allograft in Anterior Cruciate Ligament Reconstruction: A Systematic Review and Meta-analysis of Randomized Controlled Trials,"Purpose: To compare outcomes of anterior cruciate ligament (ACL) reconstruction with hamstring autograft versus softtissue allograft by systematic review and meta-analysis. Methods: A systematic review of randomized controlled studies comparing hamstring autograft with soft-tissue allograft in ACL reconstruction was performed. Studies were identified by strict inclusion and exclusion criteria. Descriptive statistics were reported. Where possible, the data were pooled and a metaanalysis was performed using RevMan software (The Nordic Cochrane Centre, The Cochrane Collaboration, Copenhagen, Denmark). Dichotomous data were reported as risk ratios, whereas continuous data were reported as standardized mean differences and 95% confidence intervals. Heterogeneity was assessed by use of I-2 for each meta-analysis. Study methodologic quality was analyzed with the Modified Coleman Methodology Score and Jadad scale. Results: Five studies with 504 combined patients (251 autograft and 253 allograft; 374 male and 130 female patients) with a mean age of 29.9 +/- 2.2 years were included. The allografts used were fresh-frozen hamstring, irradiated hamstring, mixture of fresh-frozen and cryopreserved hamstring, fresh-frozen tibialis anterior, and fresh-frozen Achilles tendon grafts without bone blocks. The mean follow-up period was 47.4 +/- 26.9 months, with a mean follow-up rate of 83.3% +/- 8.6%. Two studies found a longer operative time with autograft than with allograft (77.1 +/- 2.0 minutes v 59.9 +/- 0.9 minutes, P = .008). Meta-analysis showed no statistically significant differences between autografts and allografts for any outcome measures (P > .05 for all tests). One study found significantly greater laxity for irradiated allograft than for autograft. The methodologic quality of the 5 studies was poor, with a mean Modified Coleman Methodology Score of 54.4 +/- 6.9 and mean Jadad score of 1.6 +/- 1.5. Conclusions: On the basis of this systematic review and meta-analysis of 5 randomized controlled trials, there is no statistically significant difference in outcome between patients undergoing ACL reconstruction with hamstring autograft and those undergoing ACL reconstruction with soft-tissue allograft. These results may not extrapolate to younger patient populations. The methodology of the available randomized controlled trials comparing hamstring autograft and soft-tissue allograft is poor.",2014,English
4,5,,web_of_science,10.1002/14651858.CD010071.pub3,"Moraes, VY; Lenza, M; Tamaoki, MJ; Faloppa, F; Belloti, JC",COCHRANE DATABASE OF SYSTEMATIC REVIEWS,Platelet-rich therapies for musculoskeletal soft tissue injuries,"Background Platelet-rich therapies are being used increasingly in the treatment of musculoskeletal soft tissue injuries such as ligament, muscle and tendon tears and tendinopathies. These therapies can be used as the principal treatment or as an augmentation procedure (application after surgical repair or reconstruction). Platelet-rich therapies are produced by centrifuging a quantity of the patient's own blood and extracting the active, platelet-rich, fraction. The platelet-rich fraction is applied to the injured tissue; for example, by injection. Platelets have the ability to produce several growth factors, so these therapies should enhance tissue healing. There is a need to assess whether this translates into clinical benefit. Objectives To assess the effects (benefits and harms) of platelet-rich therapies for treating musculoskeletal soft tissue injuries. Search methods We searched the Cochrane Bone, Joint and Muscle Trauma Group Specialised Register (25March 2013), the Cochrane Central Register of Controlled Trials (CENTRAL 2013 Issue 2), MEDLINE (1946 to March 2013), EMBASE (1980 to 2013 Week 12) and LILACS (1982 toMarch 2012). We also searched trial registers (to Week 2 2013) and conference abstracts (2005 toMarch 2012). No language or publication restrictions were applied. Selection criteria We included randomised and quasi-randomised controlled trials that compared platelet-rich therapy with either placebo, autologous whole blood, dry needling or no platelet-rich therapy for people with acute or chronic musculoskeletal soft tissue injuries. Primary outcomes were functional status, pain and adverse effects. Data collection and analysis Two review authors independently extracted data and assessed each study's risk of bias. Disagreement was resolved by discussion or by arbitration by a third author. We contacted trial authors for clarification of methods or missing data. Treatment effects were assessed using risk ratios for dichotomous data and mean differences (MD) or standardised mean differences (SMD) for continuous data, together with 95% confidence intervals. Where appropriate, data were pooled using the fixed-effect model for RR and MD, and the random-effects model for SMD. The quality of the evidence for each outcome was assessed using GRADE criteria. Main results We included data from 19 small single centre trials (17 randomised and two quasi-randomised; 1088 participants) that compared platelet-rich therapy with placebo, autologous whole blood, dry needling or no platelet-rich therapy. These trials covered eight clinical conditions: rotator cuff tears (arthroscopic repair) (six trials); shoulder impingement syndrome surgery (one trial); elbow epicondylitis (three trials); anterior cruciate ligament (ACL) reconstruction (four trials), ACL reconstruction (donor graft site application) (two trials), patellar tendinopathy (one trial), Achilles tendinopathy (one trial) and acute Achilles rupture surgical repair (one trial). We also grouped trials into 'tendinopathies' where platelet-rich therapy (PRT) injections were the main treatment (five trials), and surgical augmentation procedures where PRT was applied during surgery (14 trials). Trial participants were mainly male, except in trials including rotator cuff tears, and elbow and Achilles tendinopathies. Three trials were judged as being at low risk of bias; the other 16 were at high or unclear risk of bias relating to selection, detection, attrition or selective reporting, or combinations of these. The methods of preparing platelet-rich plasma (PRP) varied and lacked standardisation and quantification of the PRP applied to the patient. We were able to pool data for our primary outcomes (function, pain, adverse events) for a maximum of 11 trials and 45% of participants. The evidence for all primary outcomes was judged as being of very low quality. Data assessing function in the short term(up to three months) were pooled from four trials that assessed PRT in three clinical conditions and used four different measures. These showed no significant difference between PRT and control (SMD 0.26; 95% confidence interval (CI) -0.19 to 0.71; P value 0.26; I-2 = 51%; 162 participants; positive values favour PRT). Medium-term function data (at six months) were pooled from five trials that assessed PRT in five clinical conditions and used five different measures. These also showed no difference between groups (SMD -0.09, 95% CI -0.56 to 0.39; P value 0.72; I-2 = 50%; 151 participants). Long-term function data (at one year) were pooled from 10 trials that assessed PRT in five clinical conditions and used six different measures. These also showed no difference between groups (SMD 0.25, 95% CI -0.07 to 0.57; P value 0.12; I-2 = 66%; 484 participants). Although the 95% confidence intervals indicate the possibility of a poorer outcome in the PRT group up to a moderate difference in favour of PRT at short-and long-term follow-up, these do not translate into clinically relevant differences. Data pooled from four trials that assessed PRT in three clinical conditions showed a small reduction in short-term pain in favour of PRT on a 10-point scale (MD -0.95, 95% CI -1.41 to -0.48; I-2 = 0%; 175 participants). The clinical significance of this result is marginal. Four trials reported adverse events; another seven trials reported an absence of adverse events. There was no difference between treatment groups in the numbers of participants with adverse effects (7/241 versus 5/245; RR 1.31, 95% CI 0.48 to 3.59; I-2 = 0%; 486 participants). In terms of individual conditions, we pooled heterogeneous data for long-term function from six trials of PRT application during rotator cuff tear surgery. This showed no statistically or clinically significant differences between the two groups (324 participants). The available evidence is insufficient to indicate whether the effects of PRT will differ importantly in individual clinical conditions. Authors' conclusions Overall, and for the individual clinical conditions, there is currently insufficient evidence to support the use of PRT for treating musculoskeletal soft tissue injuries. Researchers contemplating RCTs should consider the coverage of currently ongoing trials when assessing the need for future RCTs on specific conditions. There is need for standardisation of PRP preparation methods.",2014,English
5,6,23538044.0,web_of_science,10.1016/j.arthro.2013.01.025,"Noh, JH; Roh, YH; Yang, BG; Yi, SR; Lee, SY",ARTHROSCOPY-THE JOURNAL OF ARTHROSCOPIC AND RELATED SURGERY,Femoral Tunnel Position on Conventional Magnetic Resonance Imaging After Anterior Cruciate Ligament Reconstruction in Young Men: Transtibial Technique Versus Anteromedial Portal Technique,"Purpose: The purpose of this study was to compare clinical outcomes after single-bundle anterior cruciate ligament (ACL) reconstruction with a free Achilles tendon allograft using either a transtibial or an anteromedial portal technique and then to quantify the difference in femoral tunnel position between these 2 approaches. This assessment was to be performed with a new method using conventional magnetic resonance imaging (MRI) with a digital imaging system. Methods: In this prospective randomized comparative study, 53 young male patients with ACL rupture underwent ACL reconstruction with the transtibial technique (group 1) or the anteromedial portal technique (group 2). We assessed clinical outcomes with the Lachman test, pivot shift test, International Knee Documentation Committee (IKDC) classification, Lysholm score, Tegner activity scale, and single leg hop (SLH) test. Radiologic assessments included the position of the femoral tunnel aperture and the posterior cruciate ligament (PCL) index on conventional MRI and the side-to-side difference (SSD) on stress radiographs. Results: Sixty-one participants had follow-up. The mean follow-up period was 30.2 months. At the last follow-up, there were no significant differences between the 2 groups in results from the Lachman test, pivot shift test, IKDC classification, Tegner activity scale, and SLH test. The Lysholm score and SSD results in group 2 were superior to those in group 1 (P < .001). The femoral tunnel aperture was positioned more posteriorly in group 2 than in group 1 (P < .001). Changes in the PCL index were greater in group 1 than in group 2 (P < .001). Conclusions: The position of the femoral tunnel aperture created with the anteromedial portal technique was more posterior than that made with the transtibial technique. Knees reconstructed with the anteromedial portal technique were more stable in Telos testing, and were 3 points higher on the Lysholm score. However, there were no statistically significant differences in the Tegner activity scale or IKDC classification between the 2 groups. Level of Evidence: Therapeutic level I, randomized controlled clinical trial.",2013,English
6,7,23369444.0,web_of_science,10.1016/j.arthro.2012.10.023,"Noh, JH; Yang, BG; Yi, SR; Roh, YH; Lee, JS",ARTHROSCOPY-THE JOURNAL OF ARTHROSCOPIC AND RELATED SURGERY,Single-Bundle Anterior Cruciate Ligament Reconstruction in Active Young Men Using Bone-Tendon Achilles Allograft Versus Free Tendon Achilles Allograft,"Purpose: The purpose was to prospectively compare the outcomes of anterior cruciate ligament (ACL) reconstruction using bone-tendon Achilles allograft with those of free tendon Achilles allograft in 2 groups of active young men. Methods: We enrolled 72 subjects in the study. Of these, 33 subjects who had ACL reconstruction with Achilles allograft with calcaneal bone block on its end (group I) and 34 who had ACL reconstruction with free tendon Achilles allograft (group II) were followed up for a minimum of 2 years. The Lachman test, pivot-shift test, and 1-leg hop test were evaluated at the last follow-up. The International Knee Documentation Committee classification, Lysholm score, and side-to-side difference were assessed preoperatively and at the last follow-up. The Tegner activity scale was evaluated before injury and at the last follow-up. Results: The mean follow-up period was 30.9 months (range, 26 to 38 months). At the last follow-up, there were no statistically significant differences between the 2 groups for the Lachman test, pivot-shift test, 1-leg hop test, International Knee Documentation Committee classification, Lysholm score, and side-to-side difference (P > .05). Three subjects in group I and three in group II showed an activity level 2 steps below the preinjury activity level. The rest of the subjects returned to the preinjury activity level or showed a level 1 step below the preinjury activity level. Conclusions: There were no significant differences in clinical outcomes of ACL reconstructions using Achilles allograft between the bone-tendon group and the free tendon group in active young men. Free tendon Achilles allograft may be considered an option for ACL reconstruction. Level of Evidence: Level II, therapeutic study, randomized controlled trial.",2013,English
